{
  "$schema": "../../../../docs/schemas/afterleaf-provider.schema.json",
  "apiVersion": 1,
  "kind": "afterleaf-content-provider",
  "entry": "plugin.ts",
  "descriptor": {
    "contentKinds": ["commercial-volume"],
    "defaultBlockedTags": ["pornographic"],
    "defaultLanguages": ["english"],
    "defaultQuery": "",
    "id": "mangadex",
    "name": "MangaDex",
    "queryHelp": "Searches MangaDex titles and stores small local previews of unseen translated chapters.",
    "queryLabel": "Title search",
    "queryPlaceholder": "Search manga titles",
    "requiresLanguageTag": true,
    "summary": "Regular manga from the MangaDex API"
  }
}
