{
  "$schema": "../../../../docs/schemas/afterleaf-provider.schema.json",
  "apiVersion": 1,
  "kind": "afterleaf-content-provider",
  "entry": "plugin.ts",
  "descriptor": {
    "contentKinds": ["commercial-volume"],
    "defaultBlockedTags": ["adult", "hentai", "lolicon", "shotacon", "smut"],
    "defaultLanguages": ["english"],
    "defaultQuery": "",
    "id": "weebcentral",
    "name": "WeebCentral",
    "queryHelp": "Searches WeebCentral's English catalog and stores small local previews of unseen chapters.",
    "queryLabel": "Title search",
    "queryPlaceholder": "Search manga titles",
    "requiresLanguageTag": true,
    "summary": "English manga from WeebCentral"
  }
}
